{
  "schema_version": "001short-production-plan-v1",
  "episode_id": "SH_URAKKAI_TTS_ONLY_PASS",
  "root_profile": "shrt_white_root_01",
  "project_name": "SH_URAKKAI_TTS_ONLY_PASS_Hermes",
  "production_mode": "URAKKAI",
  "audio_policy": "TTS_ONLY_MUTE_SOURCE",
  "total_duration_us": 3000000,
  "original_order": ["1", "2", "3"],
  "order_signature": ["3", "1", "2"],
  "cleared_anchors": ["A10", "A10_TEXT", "A11", "A12"],
  "timeline": [
    {
      "segment_key": "3",
      "target_range_us": [0, 1000000],
      "placements": [
        {"anchor": "VIDEO", "operation": "clone_template_segment", "asset_key": "clean_video", "source_range_us": [2000000, 3000000], "target_range_us": [0, 1000000], "volume": 0},
        {"anchor": "A9", "operation": "clone_template_segment", "asset_key": "tts_01", "target_range_us": [0, 1000000], "volume": 1}
      ]
    },
    {
      "segment_key": "1",
      "target_range_us": [1000000, 2000000],
      "placements": [
        {"anchor": "VIDEO", "operation": "clone_template_segment", "asset_key": "clean_video", "source_range_us": [0, 1000000], "target_range_us": [1000000, 2000000], "volume": 0},
        {"anchor": "A9", "operation": "clone_template_segment", "asset_key": "tts_02", "target_range_us": [1000000, 2000000], "volume": 1}
      ]
    },
    {
      "segment_key": "2",
      "target_range_us": [2000000, 3000000],
      "placements": [
        {"anchor": "VIDEO", "operation": "clone_template_segment", "asset_key": "clean_video", "source_range_us": [1000000, 2000000], "target_range_us": [2000000, 3000000], "volume": 0},
        {"anchor": "A9", "operation": "clone_template_segment", "asset_key": "tts_03", "target_range_us": [2000000, 3000000], "volume": 1}
      ]
    }
  ]
}
